{"bundle_kind":"action","entries":[{"media_type":"application/vnd.fireproof.dsse-envelope.v1+json","path":"manifest.dsse.json","role":"manifest","sha256":"b5c8410ef42a0c781dca0a842b9b2302ca442597763cc12fc7cc56170e367b8f"},{"media_type":"application/vnd.fireproof.dsse-envelope.v1+json","path":"authority.dsse.json","role":"authority","sha256":"db61f7a34891b480ac8b8b57c8d3a69cf88edd7af0ddeed214836fb51f0e4a37"},{"media_type":"application/vnd.fireproof.dsse-envelope.v1+json","path":"fulfillment.dsse.json","role":"fulfillment","sha256":"023c7aea7e612633e79f496ba3d7bfa948899451c15a2a37f04da5889032b0b2"}],"format":"fireproof.evidence-bundle/v0.1","profile":"fireproof.action-receipt/v0.2"}
